{
  "$schema": "https://schemas.auraone.ai/open-studio/telemetry/v1.json",
  "event_id": "11111111-1111-4111-8111-111111111111",
  "event_name": "app_launched",
  "event_version": 1,
  "app": {
    "flagship": "rubric-studio-open",
    "version": "0.1.0",
    "channel": "stable"
  },
  "device": {
    "install_id": "22222222-2222-4222-8222-222222222222",
    "os": "darwin",
    "os_version": "14.4",
    "arch": "aarch64"
  },
  "session_id": "33333333-3333-4333-8333-333333333333",
  "timestamp": "2026-06-14T18:00:00Z",
  "payload": {}
}
